QuestionID,Question,Answer,Explanation,Counter
299,"[…] provide organizations with the ability to manage the compliance of Azure resources across multiple subscriptions.
A. Resource groups
B. Management groups
C. Azure policies
D. Azure App Service plans

",C,"The key term in this context is “Azure Resources.” Management groups can be used to manage access, policies, and compliance for subscriptions at the subscription level. However, Azure Policy can be applied at the resource level, subscription level, and management group level. Therefore, since the question pertains to Azure resources specifically, Azure Policy would be the most appropriate choice.",0
300,"For each of the following statements, select Yes if the statement is true. 
Otherwise, select No.
- General Data Protection Regulation (GDPR) defines data protection and privacy rules. (Y/N)
- General Data Protection Regulation (GDPR) applies to companies that offer goods or services to individuals in the EU. (Y/N)
- Azure can be used to build a General Data Protection Regulation (GDPR)-compliant infrastructure. (Y/N)",YYY,"General Data Protection Regulation (GDPR) defines data protection and privacy rules: GDPR is a regulatory framework that sets guidelines for the collection and processing of personal information from individuals who live in the European Union (EU).
General Data Protection Regulation (GDPR) applies to companies that offer goods or services to individuals in the EU: GDPR not only applies to organizations based within the EU but also to those outside the EU if they provide goods or services to, or monitor the behavior of, EU data subjects.
Azure can be used to build a General Data Protection Regulation (GDPR)-compliant infrastructure: Microsoft Azure provides features and services that can help organizations meet GDPR requirements, such as data protection, access controls, and the ability to manage and monitor data compliance.",0
301,"For each of the following statements, select Yes if the statement is true. 
Otherwise, select No.
- You can add an Azure Resource Manager template to an Azure blueprint. (Y/N)
- You can assign an Azure blueprint to a resource group. (Y/N)
- You can use Azure Blueprints to grant permissions to a resource. (Y/N)",YYY,"1 : Blueprints are a declarative way to orchestrate the deployment of various resource templates and other artifacts such as: Azure Resource Manager templates (ARM templates)

2 : Resource group can be a a part of Azure Blueprint deployment but itself can be part of MANAGEMENT GROUP

3 : Yes, you can grant permission to resources",0
302,"For each of the following statements, select Yes if the statement is true. 
Otherwise, select No.
- Azure China is operated by Microsoft (Y/N)
- Azure Government is operated by Microsoft (Y/N)
- Azure Government is available only to US government agencies and their partners (Y/N)",NYY,"Microsoft Azure operated by 21Vianet (Azure China) is a physically separated instance of cloud services located in China. It's independently operated and transacted by Shanghai Blue Cloud Technology Co., Ltd. (""21Vianet""), a wholly owned subsidiary of Beijing 21Vianet Broadband Data Center Co., Ltd",0
303,"For each of the following statements, select Yes if the statement is true. 
Otherwise, select No.
- An Azure resource can have multiple Delete locks. (Y/N)
- An Azure resource inherits locks from its resource group. (Y/N)
- If an Azure resource has a Read-only lock, you can add a Delete lock to the resource. (Y/N)",YYY,"A - Can you have multiple delete locks on a resource? YES
Confirmed, with screenshots in the below article.

B - Are locks inherited from a resource group? YES
When you apply a lock at a parent scope, all resources within that scope inherit the same lock. Even resources you add later inherit the lock from the parent. The most restrictive lock in the inheritance takes precedence.
If you want to create a lock at a parent level, select the parent. The currently selected resource inherits the lock from the parent. For example, you could lock the resource group to apply a lock to all its resources.

C - If you have a read only lock, can you add a delete lock? YES
Confirmed as possible by vasonic in a previous comment in lab.",0
304,"Your company plans to migrate all on-premises data to Azure.
You need to identify whether Azure complies with the company's regional requirements.
What should you use?
A. the Knowledge Center
B. Azure Marketplace
C. the MyApps portal
D. the Trust Center",D,"Azure has more than 90 compliance certifications, including over 50 specific to global regions and countries, such as the US, the European Union, Germany,
Japan, the United Kingdom, India and China.
You can view a list of compliance certifications in the Trust Center to determine whether Azure meets your regional requirements.",0
305,"For each of the following statements, select Yes if the statement is true. 
Otherwise, select No.
- Authorization to access Azure resources can be provided only to Azure Active Directory (Azure AD) users. (Y/N)
- Identities stored in Azure Active Directory (Azure AD), third-party cloud services, and on-premises Active Directory can be used to access Azure resources. (Y/N)
- Azure has built-in authentication and authorization services that provide secure access to Azure resources. (Y/N)",NYY,"Box 1: No -
Authorization to access Azure resources can be provided by other identity providers by using federation. A commonly used example of this is to federate your on- premises Active Directory environment with Azure AD and use this federation for authentication and authorization.

Box 2: Yes -
As described above, third-party cloud services and on-premises Active Directory can be used to access Azure resources. This is known as 'federation'.
Federation is a collection of domains that have established trust. The level of trust may vary, but typically includes authentication and almost always includes authorization. A typical federation might include a number of organizations that have established trust for shared access to a set of resources.

Box 3: Yes -
Azure Active Directory (Azure AD) is a centralized identity provider in the cloud. This is the primary built-in authentication and authorization service to provide secure access to Azure resources.",0
306,"If a resource group named RG1 has a delete lock [...] can delete RG1.
A. only a member of the global administrators group
B. the delete lock must be removed before an administrator
C. an Azure policy must be modified before an administrator
D. an Azure tag must be added before an administrator ",B,"You can configure a lock on a resource group to prevent the accidental deletion of the resource group. The lock applies to everyone, including global administrators. If you want to delete the resource group, the lock must be removed first.
As an administrator, you may need to lock a subscription, resource group, or resource to prevent other users in your organization from accidentally deleting or modifying critical resources. You can set the lock level to CanNotDelete or ReadOnly. In the portal, the locks are called Delete and Read-only respectively.
- CanNotDelete means authorized users can still read and modify a resource, but they can't delete the resource.
ReadOnly means authorized users can read a resource, but they can't delete or update the resource. Applying this lock is similar to restricting all authorized
 users to the permissions granted by the Reader role.",0
307,"[…] is the process of establishing the identity of a user or service that wants to access a resource.
A. Authentification
B. Authorization
C. Conditional Access
D. Synchronization",A,"Authentication means are you who you say you are.
Authorization means do you have the required authority/permission to do what you want to do",0
308,"For each of the following statements, select Yes if the statement is true. 
Otherwise, select No.
- Single sign-on (SSO) requires that all users sign in by using the Microsoft Authenticator app. (Y/N)
- Authentication is the process of establishing which level of access an authenticated user or service has. (Y/N)
- Conditional Access uses signals collected from a user during the sign-in process to decide whether to allow or deny access requests. (Y/N)",NNY,"Single sign-on is an authentication method that allows users to sign in using one set of credentials to login across applications. Single sign-on makes it easier to manage passwords and increases security capabilities.
Authorization is the process of establishing what level of access a legitimate user or service should have.
During sign-in, Conditional Access collects signals from the user, makes decisions based on those signals, and then enforces that decision by allowing or denying the access request or challenging for a multifactor authentication response.",0
309,"What is guaranteed in an Azure Service Level Agreement (SLA) for virtual machines?
A. uptime
B. feature availability
C. bandwidth
D. performance",A,"RTO and RPO = uptime

The SLA for virtual machines guarantees 'uptime'. The amount of uptime guaranteed depends on factors such as whether the VMs are in an availability set or availability zone if there is more than one VM, the distribution of the VMs if there is more than one or the disk type if it is a single VM.
The SLA for Virtual Machines states:
- For all Virtual Machines that have two or more instances deployed across two or more Availability Zones in the same Azure region, we guarantee you will have
Virtual Machine Connectivity to at least one instance at least 99.99% of the time.
- For all Virtual Machines that have two or more instances deployed in the same Availability Set or in the same Dedicated Host Group, we guarantee you will have Virtual Machine Connectivity to at least one instance at least 99.95% of the time.
- For any Single Instance Virtual Machine using Premium SSD or Ultra Disk for all Operating System Disks and Data Disks, we guarantee you will have Virtual
Machine Connectivity of at least 99.9%.",0
310,"An Azure service is available to all Azure customers when it is in […],
A. public preview
B. private preview
C. development
D. an Enterprise Agreement (EA) subscription",A,"Public Preview means that the service is in public beta and can be tried out by anyone with an Azure subscription. Services in public preview are often offered at a discount price.
Public previews are excluded from SLAs and in some cases, no support is offered.
Incorrect Answers:
Services in private preview are available only to selected people who has signed up to the private preview program.
- Services in development are not available to the public.
- Services provided under an Enterprise Agreement (EA) subscription are available only to the subscription owner.",0
311,"Your company plans to purchase an Azure subscription.
The company's support policy states that the Azure environment must provide an option to access support engineers by phone or email.
You need to recommend which support plan meets the support policy requirement.
Solution: Recommend a Basic support plan.
Does this meet the goal?
A. Yes
B. No",B,"The Basic support plan does not have any technical support for engineers.
Access to Support Engineers via email or phone is available in the following support plans: Premier, Professional Direct and standard.",0
312,"Your company plans to purchase an Azure subscription.
The company's support policy states that the Azure environment must provide an option to access support engineers by phone or email.
You need to recommend which support plan meets the support policy requirement.
Solution: Recommend a Standard support plan.
Does this meet the goal?
A. Yes
B. No",A,"The Standard, Professional Direct, and Premier support plans have technical support for engineers via email and phone.",0
313,"Your company plans to purchase an Azure subscription.
The company's support policy states that the Azure environment must provide an option to access support engineers by phone or email.
You need to recommend which support plan meets the support policy requirement.
Solution: Recommend a Premier support plan.
Does this meet the goal?
A. Yes
B. No",A,"The Standard, Professional Direct, and Premier support plans have technical support for engineers via email and phone.",0
314,"Your company plans to request an architectural review of an Azure environment from Microsoft.
The company currently has a Basic support plan.
You need to recommend a new support plan for the company. The solution must minimize costs.
Which support plan should you recommend?
A. Premier
B. Developer
C. Professional Direct
D. Standard",C,"I’m sorry, but there is no Premier support plan listed on the Azure Support Plans Comparison page 1. There are four support plans listed: Basic, Developer, Standard, and Professional Direct 1. To request an architectural review of an Azure environment from Microsoft and minimize costs, you should recommend the Professional Direct support plan. This plan provides architecture support with guidance from a pool of ProDirect delivery managers 1.

So the correct answer is C. Professional Direct.",0
315,"For each of the following statements, select Yes if the statement is true. 
Otherwise, select No.
- Most Azure services are introduced in private preview before being introduced in public preview, and then in general availability. (Y/N)
- Azure services in public preview can be managed only by using the Azure CLI. (Y/N)
- The cost of an Azure service in private preview decreases when the service becomes generally available. (Y/N)",YNN,"Box 1: Yes -
Most services go to private preview then public preview before being released to general availability.
The private preview is only available to certain Azure customers for evaluation purposes. The public preview is available to all Azure customers.

Box 2: No -
Azure services in public preview can be managed using the regular management tools: Azure Portal, Azure CLI and PowerShell.

Box 3: No -
Services in private or public preview are usually offered at reduced costs. However, the costs increase, not decrease when the services are released to general availability.",0
316,"What is required to use Azure Cost Management?
A. a Dev/Test subscription
B. Software Assurance
C. an Enterprise Agreement (EA)
D. a pay-as-you-go subscription",D,"According to Microsoft, Azure Cost Management is enabled by default for Enterprise Agreement and Pay-As-You-Go customers, so there is no need to enable it separately. So, both C and D should be correct here",0
317,"You Azure trial account expired last week. You are now unable to [...].
A. create additional Azure Active Directory (Azure AD) user accounts.
B. start an existing Azure VM
C. access your date stored in Azure
D. access the Azure portal",B,"A stopped (deallocated) VM is offline and not mounted on an Azure host server. Starting a VM mounts the VM on a host server before the VM starts. As soon as the VM is mounted, it becomes chargeable. For this reason, you are unable to start a VM after a trial has expired.
Incorrect Answers:
- You are not charged for Azure Active Directory user accounts so you can continue to create accounts.
- You can access data that is already stored in Azure.
- You can access the Azure Portal. You can also reactivate and upgrade the expired subscription in the portal.",0
318,"Your company plans to purchase an Azure subscription.
The company's support policy states that the Azure environment must provide an option to access support engineers by phone or email.
You need to recommend which support plan meets the support policy requirement.
Solution: Recommend a Professional Direct support plan.
Does this meet the goal?
A. Yes
B. No",A,"The Basic support plan does not have any technical support for engineers.
The Developer support plan has only technical support for engineers via email.
The Standard, Professional Direct, and Premier support plans have technical support for engineers via email and phone.",0
319,"Your company has a Software Assurance agreement that includes Microsoft SQL Server licenses.
You plan to deploy SQL Server on Azure virtual machines.
What should you do to minimize licensing costs for the deployment?
A. Deallocate the virtual machines during off hours.
B. Use Azure Hybrid Benefit.
C. Configure Azure Cost Management budgets.
D. Use Azure reservations.",B,"Azure Hybrid Benefit is a licensing benefit that helps you to significantly reduce the costs of running your workloads in the cloud. It works by letting you use your on-premises Software Assurance-enabled Windows Server and SQL Server licenses on Azure.
Reference:",0
320,"Your company has 10 departments.
The company plans to implement an Azure environment.
You need to ensure that each department can use a different payment option for the Azure services it consumes.
What should you create for each department?
A. a reservation
B. a subscription
C. a resource group
D. a container instance",B,"There are different payment options in Azure including pay-as-you-go (PAYG), Enterprise Agreement (EA), and Microsoft Customer Agreement (MCA) accounts.
Your Azure costs are 'per subscription'. You are charged monthly for all resources in a subscription. Therefore, to use different payment options per department, you will need to create a separate subscription per department. You can create multiple subscriptions in a single Azure Active Directory tenant.
Incorrect Answers:
A: A reservation is where you commit to a resource (for example a virtual machine) for one or three years. This gives you a discounted price on the resource for the reservation period. Reservations do not provide a way to use different payment options per department.
C: A resource group is a logical container for Azure resources. You can view the total cost of all the resources in a resource group. However, resource groups do not provide a way to use different payment options per department.
D: A container instance is an Azure resource used to run an application. Container instances do not provide a way to use different payment options per department.",0
321,"For each of the following statements, select Yes if the statement is true. 
Otherwise, select No.
- An Azure free account has a spending limit. (Yes/No)
- An Azure free account has a limit of 2TB of data that can be uploaded to Azure. (Yes/No)
- An Azure free account can contain an unlimited number of web apps. (Yes/No)",YNN,"Box 1: Yes -
An Azure free account has a spending limit. This is currently 200 USD or 150 GBP.

Box 2: No -
Azure free account has a 5 GB blob storage limit and a 5 GB file storage limit.

Box 3: No -
Azure free account has a limit of 10 web, mobile or API apps",0
322,"For each of the following statements, select Yes if the statement is true. 
Otherwise, select No.
- An Azure service in private preview is released to all Azure customers. (Y/N)
- An Azure service in public preview is released to all Azure customers. (Y/N)
- An Azure service in general availability is released to a subset of Azure customers. (Y/N)",NYN,"Box 1: No -
Most services go to private preview then public preview before being released to general availability. The private preview is only available to certain Azure customers for evaluation purposes.

Box 2: Yes -
Public Preview means that the service is in public beta and can be tried out by anyone with an Azure subscription. Services in public preview are often offered at a discount price.
Public previews are excluded from SLAs and in some cases, no support is offered.

Box 3: No -
An Azure service in general availability is available to all Azure customers, not just a subset of the customers.",0
323,"For each of the following statements, select Yes if the statement is true. 
Otherwise, select No.
- Availability zones can be implemented in all Azure regions. (Y/N)
- Only VM that run Windows Server can be created in availability zones. (Y/N)
- Availability zones are used to replicate data and applications to multiple regions. (Y/N)",NYY,"CONSUMPTION MODEL: Users only pay for the resources that they use, no up-front costs. No need to purchase/manage costly infrastructure that not use fullest.
Ability to pay/stop paying for additional resources when needed.
No fixed rate for all data sends because resources are metered/billed according they consume.
SERVERLES COMPUTING: Highly scalable/event-driven, only resources when a specific function or trigger occurs.",0
324,"For each of the following statements, select Yes if the statement is true. 
Otherwise, select No.
- The cost of Azure resources can vary between regions. (Y/N)
- An Azure reservation is used to reserve server capacity at a specific data center. (Y/N)
- You can stop an Azure SQL Database instance to decrease costs. (Y/N)",YYN,"Azure reservations can be used to reserve capacity for Azure virtual machines (VMs) or other Azure resources, such as Azure SQL Database. When you make a reservation, you are committing to a certain level of usage over a period of time, usually one or three years. In return, you receive a discounted rate for the reserved capacity.

If you bought Azure Reserved Virtual Machine Instances, you can change the optimize setting for the reservation. The reservation discount can apply to VMs in the same series or you can reserve data center capacity for a specific VM size. You should try to optimize reservations so that they're fully used.",0
325,"You have an application that is comprised of an Azure web app that has a Service Level Agreement (SLA) of 99.95 percent and an Azure SQL database that has an SLA of 99.99 percent. The composite SLA for the application is [...].
A. the product of both SLAs, which equals 99.94 percent 
B. the lowest SLA associated to the application, which is 99.95 percent 
C. the highest SLA associated to the application, which is 99.99 percent 
D. the difference between the two SLAs, which is 0.05 percent",A,"Composite SLAs involve multiple services supporting an application, each with differing levels of availability. For example, consider an App Service web app that writes to Azure SQL Database. At the time of this writing, these Azure services have the following SLAs:
- App Service web apps = 99.95%
- SQL Database = 99.99%
What is the maximum downtime you would expect for this application? If either service fails, the whole application fails. The probability of each service failing is independent, so the composite SLA for this application is 99.95% ֳ— 99.99% = 99.94%. That's lower than the individual SLAs, which isn't surprising because an application that relies on multiple services has more potential failure points.",0
326,"For each of the following statements, select Yes if the statement is true. 
Otherwise, select No.
- The Service Level Agreement (SLA) guaranteed uptime for paid Azure services is at least 99.9 percent. (Y/N)
- Companies can increase the Service Level Agreement (SLA) guaranteed uptime by adding Azure resources to multiple regions. (Y/N)
- Companies can increase the Service Level Agreement (SLA) guaranteed uptime by purchasing multiple subscriptions. (Y/N)",YYN,"Box 1: Yes -
SLA's vary based on the resource type and the location distribution of the resource. However, the minimum uptime for all Azure services is 99.9 percent.

Box 2: Yes -
The SLA guaranteed uptime is increased (usually to 99.95 percent) when resources are deployed across multiple regions.

Box 3: No -
The number of subscriptions is unrelated to uptime SLA's. You can deploy resources to multiple regions under a single subscription or you can have multiple subscriptions with resources deployed to the same region.",0
327,"Which statement accurately describes the Modern Lifecycle Policy for Azure services?
A. Microsoft provides mainstream support for a service for five years.
B. Microsoft provides a minimum of 12 months' notice before ending support for a service.
C. After a service is made generally available, Microsoft provides support for the service for a minimum of four years.
D. When a service is retired, you can purchase extended support for the service for up to five years.",B,"For products governed by the Modern Lifecycle Policy, Microsoft will provide a minimum of 12 months' notification prior to ending support if no successor product or service is offered ג€"" excluding free services or preview releases.",0
328,"You need to request that Microsoft increase a subscription quota limit for your company.
Which blade should you use from the Azure portal? To answer, select the appropriate blade in the answer area.
Hot Area:
A. Dashboard
B. All Services
C. Monitor
D. Advisor
E. Security Center
F. Help + Support",F,Request a standard quota increase from Help + support,0
329,"You can use […] in Azure to send email alerts when the cost of the current billing period for an Azure subscription exceeds a specified limit.
A. Advisor recommendations
B. Access control (IAM)
C. Budget alerts
D. Compliance",C,"Budget alerts notify you when spending, based on usage or cost, reaches or exceeds the amount defined in the alert condition of the budget. Cost Management budgets are created using the Azure portal or the Azure Consumption API.",0
330,"For each of the following statements, select Yes if the statement is true. 
Otherwise, select No.
- From the Azure portal, you can distinguish between services that are generally available and services that are in public preview. (Y/N)
- After an Azure service becomes generally available, the service is no longer updated with new features. (Y/N)
- When you create Azure resources for a service in public preview, you must recreate the resources once the service becomes generally available. (Y/N)",YNN,That a product is in generally available does not mean it can't be updated with new and exciting features,0
