QuestionID,Question,Answer,Explanation,Counter
123,"You need to be notified when Microsoft plans to perform maintenance that can affect the resources deployed to an Azure subscription.
What should you use?
A. Azure Monitor
B. Azure Service Health
C. Azure Advisor
D. Microsoft Trust Center",B,"Azure Service Health provides a personalized view of the health of the Azure services and regions you're using. This is the best place to look for service impacting communications about outages, planned maintenance activities, and other health advisories because the authenticated Service Health experience knows which services and resources you currently use.",0
124,"A. Azure Sphere
B. IoT Central
C. IoT Hub
1. A software and hardware solution that provides communication and security features for IoT devices
2. A fully managed software as a service (SaaS) solution to connect, monitor, and manage IoT devices at scale
3. A managed service that provides bidirectional communication between IoT devices and Azure




",A3B2C1,"hu(b) = (b)iderectional
(c)entral = (c)onnect
(s)phere = (s)ecurity",0
125,"For each of the following statements, select Yes if the statement is true. 
Otherwise, select No.
- A Windows Virtual Desktop session host can run Windows 10 only. (Y/N)
- A Windows Virtual Desktop host pool that includes 20 session hosts supports a maximum of 20 simultaneous user connections. (Y/N)
- Windows Virtual Desktop supports desktop and app virtualization. (Y/N)",NNY,"1. NO - Supported O/Ses are Windows 10 Enterprise multi-session or Windows 10 Enterprise, Windows 7 Enterprise, Windows Server 2012 R2, 2016, 2019.
2. NO - For Max session limit, enter the maximum number of users you want load-balanced to a single session host
3. YES- Via RemoteApps",0
126,"[…] can calculate cost savibgs due to reduced electricity consumption as a result of migrating on-premises Microsoft SQL servers to Azure.
A. The Azure Migrate: Server Assessment tool
B. The Azure Total Cost of Ownership (TCO) calculator
C. The Database Migrating Assistant
D. The pricing calculator in Azure",B,"The Azure Total Cost of Ownership (TCO) calculator is a free online tool that allows you to estimate the cost savings you can achieve by migrating your application workloads to Microsoft Azure. It helps you to evaluate potential cost savings if you migrate on-premises application workloads to Microsoft Azure by specifying the details of your existing infrastructure and various cost assumptions you want the tool to work with. You can then receive a report that shows on-premises costs compared to Microsoft Azure costs.

Here are the reasons why the other options are incorrect:
The pricing calculator in Azure: It is an online tool that provides estimates of the cost of Azure products and services 5. While it can help you estimate the costs for Azure products and services, it is not specifically designed to calculate cost savings due to reduced electricity consumption as a result of migrating on-premises Microsoft SQL servers to Azure.",0
127,"For each of the following statements, select Yes if the statement is true. 
Otherwise, select No.
- You can use Availability Zones in Azure to protect Azure virtual machines from a datacenter failure. (Y/N)
- You can use Availability Zones in Azure to protect Azure virtual machines from a region failure. (Y/N)
- You can use Availability Zones in Azure to protect Azure managed disks from a datacenter failure. (Y/N)",YNY,"Availability zones expand the level of control you have to maintain the availability of the applications and data on your VMs. Availability Zones are unique physical locations within an Azure region. Each zone is made up of one or more datacenters equipped with independent power, cooling, and networking. To ensure resiliency, there are a minimum of three separate zones in all enabled regions. The physical separation of Availability Zones within a region protects applications and data from datacenter failures.
With Availability Zones, Azure offers industry best 99.99% VM uptime SLA. By architecting your solutions to use replicated VMs in zones, you can protect your applications and data from the loss of a datacenter. If one zone is compromised, then replicated apps and data are instantly available in another zone.",0
128,"For each of the following statements, select Yes if the statement is true.
Otherwise, select No.
- An Azure subscription can have multiple account administrators. (Y/N)
- An Azure subscription can be managed by using a Microsoft account only. (Y/N)
- An Azure resource group can contain multiple Azure subscriptions. (Y/N)",NNN,"Box 1: No -
You can assign service administrators and co-administrators in the Azure Portal but there can only be one account administrator.

Box 2: No -
You need an Azure Active Directory account to manage a subscription, not a Microsoft account.
An account is created in the Azure Active Directory when you create the subscription. Further accounts can be created in the Azure Active Directory to manage the subscription.

Box 3: No -
Resource groups are logical containers for Azure resources. However, resource groups do not contain subscriptions. Subscriptions contain resource groups.",0
129,"A cloud service that supports a maximum of 20 instances is more […] than a service that supports a maximum of five instances.
A. distributed
B. scalable
C. secure",B,"The correct answer is scalable.
A cloud service that supports a maximum of 20 instances is more scalable than a service that supports a maximum of five instances. Scalability refers to the ability of a system to handle increased workload by adding resources to the system. In this case, a cloud service that supports a maximum of 20 instances can handle more workload than a service that supports a maximum of five instances, making it more scalable.
Here are the reasons why the other options are incorrect:
Distributed: A distributed system is one in which components are located on different networked computers and communicate and coordinate their actions by passing messages. While a cloud service can be distributed, the number of instances it supports does not determine whether it is distributed or not.
Secure: Security refers to the measures taken to protect a system from unauthorized access or attack. While security is an important aspect of cloud services, the number of instances it supports does not determine whether it is secure or not.",0
130,"For each of the following statements, select Yes if the statement is true.
Otherwise, select No.
- To use Azure Active Directory (Azure AD) credentials to sign in to a computer that runs Windows 10, the computer must be joined to Azure AD. (Y/N)
- Users in Azure Active Directory (Azure AD) are organized by using resource groups. (Y/N)
- Azure Active Directory (Azure AD) groups support dynamic membership rules. (Y/N)",YNY,"To use Azure Active Directory (Azure AD) credentials to sign in to a computer that runs Windows 10, the computer must be joined to Azure AD. Yes, this statement is true. To use Azure AD credentials to sign in to a computer that runs Windows 10, the computer must be joined to Azure AD.
Users in Azure Active Directory (Azure AD) are organized by using resource groups. No, this statement is incorrect. Users in Azure AD is organized by using directories, domains, and organizational units (OUs).
Azure Active Directory (Azure AD) groups support dynamic membership rules. Yes, this statement is true. Azure AD groups support dynamic membership rules that allow you to add or remove members based on user or device attributes.",0
131,"You plan to deploy several Azure virtual machines.
You need to ensure that the services running on the virtual machines remain available if a single data center fails.
What are two possible solutions? Each correct answer presents a complete solution.
A. Deploy the virtual machines to two or more availability zones.
B. Deploy the virtual machines to two or more resource groups.
C. Deploy the virtual machines to a scale set.
D. Deploy the virtual machines to two or more regions.",AD,None,0
132,"You plan to deploy 20 VM to an Azure environment. To ensure that a VM named VM1 cannot connect to the other VM, VM1 must […].
A. be deployed to a separate VM
B. run a different operating system than the other VMs
C. be deployed to a separate resource group
D. have 2 network interfaces",B,"Azure automatically routes traffic between subnets in a virtual network. Therefore, all virtual machines in a virtual network can connect to the other virtual machines in the same virtual network. Even if the virtual machines are on separate subnets within the virtual network, they can still communicate with each other.
To ensure that a virtual machine cannot connect to the other virtual machines, the virtual machine must be deployed to a separate virtual network.",0
133,"A. Azure Cosmos DB
B. Azure HDInsight
C. Azure Synapse Analytics
1. A fully managed data warehouse that has integral security at every level of scale at no extra cost.
2. A globally distributed database that supports NoSQL.
3. Managed Apache Hadoop clusters in the cloud that enable you to process massive amounts of data.",A2B3C1,"Azure synapse analytics = Warehouse
Azure cosmos = even larger than the globe (global) : cosmos
Azure HDInsight = HaDoop",0
134,"What is the most severe failure from which an Azure Availability Zone can be used to protect access to Azure service?
A. a physical server failure
B. an Azure region failure
C. a storage failure
D. an Azure data center failure",D,"Availability zones expand the level of control you have to maintain the availability of the applications and data on your VMs. An Availability Zone is a physically separate zone, within an Azure region. There are three Availability Zones per supported Azure region.
Each Availability Zone has a distinct power source, network, and cooling. By architecting your solutions to use replicated VMs in zones, you can protect your apps and data from the loss of a datacenter. If one zone is compromised, then replicated apps and data are instantly available in another zone.",0
135,"What is the most severe failure from which an Azure Availability Zone can be used to protect access to Azure service?
A. a physical server failure
B. an Azure region failure
C. a storage failure
D. an Azure data center failure",D,"Availability zones expand the level of control you have to maintain the availability of the applications and data on your VMs. An Availability Zone is a physically separate zone, within an Azure region. There are three Availability Zones per supported Azure region.
Each Availability Zone has a distinct power source, network, and cooling. By architecting your solutions to use replicated VMs in zones, you can protect your apps and data from the loss of a datacenter. If one zone is compromised, then replicated apps and data are instantly available in another zone.",0
136,"You need to purchase a third-party virtual security appliance that you will deploy to an Azure subscription.
What should you use?
A. Azure subscriptions
B. Azure Security Center
C. Azure Marketplace
D. Microsoft Store",C,"Azure Marketplace is a digital marketplace that offers a wide range of third-party virtual appliances, including security appliances, that can be deployed to an Azure subscription.
Azure subscriptions (option A) are used to manage access to Azure services and resources, and do not provide virtual appliances.
Azure Security Center (option B) is a unified infrastructure security management system that provides advanced threat protection across hybrid cloud workloads. While it can help you identify and mitigate security risks, it does not offer third-party virtual appliances.
Microsoft Store (option D) is an online store that offers software applications, games, and other digital content for Windows devices. It does not offer third-party virtual appliances for Azure subscriptions.
Therefore, the best option for purchasing a third-party virtual security appliance that you will deploy to an Azure subscription is C. Azure Marketplace.",0
137,"A. Azure Functions
B. Azure Logic Apps
1. Executes code :
2. Is always stateful :
3. Runs only in the cloud :",A1A2B3,"Box 1: Azure Functions -
Azure Functions allows you to implement your system's logic into readily available blocks of code called ""functions"". Different functions can run anytime you need to respond to critical events.

Box 2: Azure Functions -
Azure Logic Apps can have multiple stateful and stateless workflows.

Box 3: Azure Logic Apps -
Azure Logic Apps is a cloud-based platform for creating and running automated workflows that integrate your apps, data, services, and systems.",0
138,"A. Azure Blueprints
B. Azure Policy
C. Azure resource group
D. Azure tags
1. Restrict which VM types can be created in a subscrption
2. Identify Azure resources that are associated with specific cost centers
3. Deploy a complete Azure application environment including resources configuration and role assigments",A3D2B1,"Policy = Restrict
Tag = Identify
BP = Deploy",0
139,"An Availability Zone in Azure has physically separate locations […].
A. accross two continents.
B. within a single Azure region.
C. within multiple Azure regions.
D. within a single Azure datacenter.",B,"Box: within a single Azure region
Azure availability zones are physically separate locations within each Azure region that are tolerant to local failures.",0
140,"A. Azure Functions
B. Azure App Service
C. Azure Virtual Machines
D. Azure Container Instances
1. Provide operating system virtualization
2. Provide portable environment for virtualized applications
3. Used to build, deploy, and scale web apps
4. Provide a platform for serverless code",A4B3C1D2,"Easy to memorize, VM, CONTAINER = PART OF VM OS, APP = APP SERVICE , CODE = FUNCTION

Box 1: Azure virtual machines -
Box 2: Azure Container instances
Azure Container Instances (ACI) is a managed service that allows you to run containers directly on the Microsoft Azure public cloud, without requiring the use of virtual machines (VMs).
Develop apps fast without managing virtual machines or having to learn new toolsג€""it's just your application, in a container, running in the cloud.

Box 3: Azure App Service -
Azure App Service is a fully managed platform for building web applications.
Applications run and scale with ease on both Windows and Linux-based environments.

Box 4: Azure Functions -
Azure Functions (from Microsoft Azure) is a cloud-based serverless service that allows running event-triggered code in a scalable way without providing or managing infrastructure.",0
141,"You have several VM in an Azure subscription. You create a new subscription :
A. The VM cannot be moved to the new subscription.
B. The VM can be moved to the new subscription.
C. The VM can be moved to the new subscription only if they run all in the same resource group
D. The VM can be moved to the new subscription only if they run Windows Server 2019",B,"Box: The virtual machines can be moved to the new subscription.
You can move a VM and its associated resources to a different subscription by using the Azure portal.
Note: Repeat the process below for each Resource Group containing the VMs.
1. Go to the Azure portal to manage the resource group containing the VM to move. Search for and select Resource groups.
2. Choose the resource group containing the VM that you would like to move.
3. At the top of the page for the resource group, select Move and then select Move to another subscription. The Move resources page opens.
4. Select each of the resources to move. In most cases, you should move all of the related resources that are listed.
5. Select the Subscription where you want the VM to be moved.
6. Select an existing Resource group, or enter a name to have a new resource group created.
7. When you are done, select that you understand that new resource IDs will be created and that the new IDs will need to be used with the VM after it is moved, and",0
142,"You need to purchase a third-party virtual security appliance that you will deploy to an Azure subscription.
What should you use?
A. Azure subscriptions
B. Microsoft Defender for Cloud
C. Azure Marketplace
D. Microsoft Store",C,"You can access these enhanced network security features by using an Azure partner solution. You can find the most current Azure partner network security solutions by visiting the Azure Marketplace, and searching for ""security"" and ""network security.""",0
143,"[…] is a highly secure IoT solution that includes a microcontroller unit (MCU) and a customized operatring system.
A. Azure Arc
B. Azure IoT Central
C. Azure IoT Hub
D. Azure Sphere",D,"Azure Arc is a hybrid cloud management solution that enables you to manage your servers, Kubernetes clusters, and applications across on-premises, multi-cloud, and edge environments from a single control plane.
Azure IoT Central is an IoT application platform that simplifies the creation of IoT solutions. It enables you to connect, monitor, and manage your IoT devices at scale.
Azure IoT Hub is a fully managed service that enables reliable and secure bidirectional communications between millions of IoT devices and an application back end.
Therefore, the correct answer is Azure Sphere because it is the only option that includes a microcontroller unit (MCU) and a customized Linux operating system.",0
144,"You plan to deploy a service to Azure virtual machines.
You need to ensure that the service will be available if a datacenter fails.
What should you use as part of the virtual machine deployment?
A. availability sets
B. proximity placement groups
C. host groups
D. availability zones",D,"Azure availability zones are physically separate locations within each Azure region that are tolerant to local failures. Failures can range from software and hardware failures to events such as earthquakes, floods, and fires. Tolerance to failures is achieved because of redundancy and logical isolation of Azure services. To ensure resiliency, a minimum of three separate availability zones are present in all availability zone-enabled regions.",0
145,"Your company has an Azure subscription that contains resources in several regions.
You need to ensure that administrators can only create resources in those regions.
What should you use?
A. a read-only lock
B. an Azure policy
C. a management group
D. a reservation",B,"Explanation: Azure Policy evaluates resources and actions in Azure by comparing the properties of those resources to business rules. These business rules, described in JSON format, are known as policy definitions. To simplify management, several business rules can be grouped together to form a policy initiative (sometimes called a policySet). Once your business rules have been formed, the policy definition or initiative is assigned to any scope of resources that Azure supports, such as management groups, subscriptions, resource groups, or individual resources. The assignment applies to all resources within the Resource Manager scope of that assignment. Subscopes can be excluded, if necessary. For more information, see Scope in Azure Policy.",0
146,"An Azure region […].
A. contains one or more data centers that are connected by using a low-latency network
B. is found in each country where Microsoft has a subsidiary office
C. can be found in every country in Europe and the Americas only
D. contains one or more data center that are connected by using a high-latency network",A,"Box: contains one or more data centers that are connected by using a low-latency network.
Each Azure region features datacenters deployed within a latency-defined perimeter. They're connected through a dedicated regional low-latency network. This design ensures that Azure services within any region offer the best possible performance and security.",0
147,"You can use the Azure File Sync agent to sync on-premises data to an Azure […].
A. blob container
B. Data Lake Storage container
C. file share
D. queue",C,The Azure File Sync agent enables data on a Windows Server to be synchronized with an Azure File share.,0
148,"What is the function of a Site-to-Site VPN?
A. provides a secure connection between a computer on a public network and the corporate network
B. provides a dedicated private connection to Azure that does NOT travel over the internet
C. provides a connection from an on-premises VPN device to an Azure VPN gateway",C,"A Site-to-Site VPN gateway connection is used to connect your on-premises network to an Azure virtual network over an IPsec/IKE (IKEv1 or IKEv2) VPN tunnel.
This type of connection requires a VPN device located on-premises that has an externally facing public IP address assigned to it.",0
149,"A. IaaS
B. PaaS
C. SaaS
1. Azure App Service
2. Azure VM
3. Microsoft Dynamic 365",A2B1C3,"Box 1: Platform as a service (PaaS)
Azure App Service is a fully managed platform for building web applications.
Platform as a service (PaaS) is a complete development and deployment environment in the cloud, with resources that enable you to deliver everything from simple cloud-based apps to sophisticated, cloud-enabled enterprise applications.
Box 2: Infrastructure as a service (IaaS)
Windows Azure Virtual Machines, an Infrastructure-as-a-Service (IaaS) offering in Windows Azure, was released back in 2012.
Box 3: Software as a service (SaaS)
Dynamics 365 is a set of interconnected, modular Software-as-a-Service (SaaS) applications and services designed to both transform and enable your core customers, employees, and business activities.",0
150,"A. IaaS
B. PaaS
C. SaaS
1. A cloud-based file server
2. A cloud-based accounting system
3. A cloud-based service for custom apps",A1B3C2,"Box 1: Infrastructure as a service (IaaS)
Azure Files is a simple, secure, and serverless enterprise-grade cloud file shares.
Infrastructure as a service (IaaS) is a type of cloud computing service that offers essential compute, storage, and networking resources on demand, on a pay-as- you-go basis.
Box 2: Software as a service (SaaS)
Dynamics 365 is a set of interconnected, modular Software-as-a-Service (SaaS) applications and services designed to both transform and enable your core customers, employees, and business activities. It includes Dynamics 365 Finance: use the guided, rules-based chart of accounts and no-code configuration service to simplify regulatory reporting, electronic invoicing, and global payments.
Box 3: Platform as a service (PaaS)
Platform as a service (PaaS) is a complete development and deployment environment in the cloud, with resources that enable you to deliver everything from simple cloud-based apps to sophisticated, cloud-enabled enterprise applications.",0
151,"Which two services can you use? Each correct answer presents a complete solution.
NOTE: Each correct selection is worth one point.
A. Azure Virtual Desktop
B. Azure virtual machines
C. Azure Functions
D. Azure Container Instances
E. Azure Kubernetes Service (AKS)",DE,"Run Docker containers on-demand in a managed, serverless Azure environment. Azure Container Instances is a solution for any scenario that can operate in isolated containers, without orchestration. Run event-driven applications, quickly deploy from your container development pipelines, and run data processing and build jobs.
You can manage containers at scale with a fully managed Kubernetes container management and orchestration service that integrates with Azure Active
Directory.
Azure Kubernetes Service is a robust and cost-effective container orchestration service that helps you to deploy and manage containerized applications in seconds where additional resources are assigned automatically without the headache of managing additional servers.",0
152,"When you need to delegate permissions to several Azure VM simultaneously, you must deploy the Azure VM […].
A. to the same Azure region
B. by using the same Azure Resource Manager template
C. to the same resource group
D. to the same availability zone
",C,"C. to the same resource group.

This is the correct answer because you can manage access control and permissions more efficiently by deploying Azure virtual machines to the same resource group. Azure allows you to apply RBAC (Role-Based Access Control) to resource groups, which means you can grant the same permissions to multiple virtual machines in the same resource group simultaneously. It simplifies the process of delegating permissions across multiple VMs.

A. Deploying VMs to the same Azure region does not have any direct impact on the ability to delegate permissions. Regions define the physical location of data centers, not access control.

B. Using the same Azure Resource Manager template is a method for deploying VMs with similar configurations but doesn't directly relate to managing permissions or access control.

D. Deploying VMs to the same availability zone is a strategy for improving high availability and fault tolerance but doesn't inherently affect the delegation of permissions.",0
153,"You plan to deploy several Azure virtual machines.
You need to ensure that the services running on the virtual machines are available if a single data center fails.
Solution: You deploy the virtual machines to two or more availability zones.
Does this meet the goal?
A. Yes
B. No",A,"Availability zones expand the level of control you have to maintain the availability of the applications and data on your VMs. An Availability Zone is a physically separate zone, within an Azure region. There are three Availability Zones per supported Azure region.
Each Availability Zone has a distinct power source, network, and cooling. By architecting your solutions to use replicated VMs in zones, you can protect your apps and data from the loss of a datacenter. If one zone is compromised, then replicated apps and data are instantly available in another zone.",0
