QuestionID,Question,Answer,Explanation,Counter
1,"Your company intends to subscribe to an Azure support plan. 
The support plan must allow for new support requests to be opened. 
Which of the following are support plans that will allow this?
A. Basic
B. Developer
C. Standard
D. Professional Direct
E. Premier",BCD,All Azure support plans except for the Basicand the Premier plan allow for the opening of new support requests. The Basic plan offers only limited support for billing and subscription management issues and does not include technical support for services. Premier support plans are being phased out and are no longer available for new customers,0
2,"Your company has datacenters in Los Angeles and New York. The company has a Microsoft Azure subscription.
You are configuring the two datacenters as geo-clustered sites for site resiliency.
You need to recommend an Azure storage redundancy option.
You have the following data storage requirements:
- Data must be stored on multiple nodes.
- Data must be stored on nodes in separate geographic locations.
- Data can be read from the secondary location as well as from the primary location
Which of the following Azure stored redundancy options should you recommend?
A. Geo-redundant storage
B. Read-only geo-redundant storage
C. Zone-redundant storage
D. Locally redundant storage",B,"Geo-redundant storage (with GRS or GZRS) replicates your data to another physical location in the secondary region to protect against regional outages.However, that data is available to be read only if the customer or Microsoft initiates a failover from the primary to secondary region. When you enable read access to the secondary region, your data is available to be read at all times, including in a situation where the primary region becomes unavailable. For read access to the secondary region, enable read-access geo-redundant storage (RA-GRS) or read-access geo-zone-redundant storage (RA-GZRS).",0
3,"Your company's Azure subscription includes a Basic support plan. 
They would like to request an assessment of an Azure environment's design from Microsoft. 
This is, however, not supported by the existing plan. 
You want to make sure that the company subscribes to a support plan that allows this functionality, while keeping expenses to a minimum. 
Solution: You recommend that the company subscribes to the Professional Direct support plan. Does the solution meet the goal?
A. Yes
B. No",B,"The solution does not meet the goal of keeping expenses to a minimum. The Professional Direct support plan is a higher-tier support plan that incurs additional costs compared to the Basic support plan. While the Professional Direct support plan does provide access to design assessments from Microsoft, it may not be the most cost-effective option for the company. It would be more appropriate to recommend a support plan that includes design assessments but still keeps expenses low, such as the Developer or Standard support plans.",0
4,"You are tasked with deploying Azure virtual machines for your company.
You need to make use of the appropriate cloud deployment solution.
Solution: You should make use of Software as a Service (SaaS).
Does the solution meet the goal?
A. Yes
B. No",B,"The solution does not meet the goal. Software as a Service (SaaS) is a cloud computing model where software applications are delivered over the internet. It typically refers to using web-based applications provided by a third-party vendor. However, in this scenario, the goal is to deploy Azure virtual machines, which is an Infrastructure as a Service (IaaS) offering. With IaaS, you can deploy and manage virtual machines in the cloud, giving you more control over the infrastructure layer. Therefore, the appropriate cloud deployment solution in this case would be Infrastructure as a Service (IaaS), not Software as a Service (SaaS).",0
5,"You are tasked with deploying Azure virtual machines for your company.
You need to make use of the appropriate cloud deployment solution.
Solution: You should make use of Platform as a Service (PaaS).
Does the solution meet the goal?
A. Yes
B. No",B,"Platform as a service refers to cloud computing services that supply an on-demand environment for developing, testing, delivering, and managing software applications. PaaS is designed to make it easier for developers to quickly create web or mobile apps, without worrying about setting up or managing the underlying infrastructure of servers, storage, network, and databases needed for development. However, in this scenario, the goal is to deploy Azure virtual machines, which is an Infrastructure as a Service (IaaS) offering. With IaaS, you can deploy and manage virtual machines in the cloud, giving you more control over the infrastructure layer. ",0
6,"You are tasked with deploying Azure virtual machines for your company.
You need to make use of the appropriate cloud deployment solution.
Solution: You should make use of Infrastructure as a Service (IaaS).
Does the solution meet the goal?
A. Yes
B. No",A,"With IaaS, you can deploy and manage virtual machines in the cloud, giving you more control over the infrastructure layer. ",0
7,"Your developers have created 10 web applications that must be host on Azure.
You need to determine which Azure web tier plan to host the web apps. The web tier plan must meet the following requirements:
- The web apps will use custom domains.
- The web apps each require 10 GB of storage.
- The web apps must each run in dedicated compute instances.
- Load balancing between instances must be included.
- Costs must be minimized.
Which web tier plan should you use?
A. Standard
B. Basic
C. Free
D. Shared",A,"Standard tier support Custom Domains, Disk Space of 50GB wich is more than enough for the requested plan, and as long as they want to run each web app in a dedicated instance, that means we need 10 dedicated instances for the 10 web apps with a load-balancing service between them, the basic plan only support up to 3 dedicated instances. Finally the Standard plan has the lowest cost compared to Premuim and Isolated pricing tiers.",0
8,"You are planning to migrate a company to Azure. Each of the company's numerous divisions will have an administrator in place to manage the Azure resources used by their respective division.
You want to make sure that the Azure deployment you employ allows for Azure to be segmented for the divisions, while keeping administrative effort to a minimum.
Solution: You plan to make use of several Azure Active Directory (Azure AD) directories.
Does the solution meet the goal?
A. Yes
B. No",B,"Azure Active Directory (AAD) is Microsoft's cloud-based identity and access management service, helping organizations manage and secure access to applications and resources. Using multiple Azure Active Directory (AAD) instances increases complexity due to separate management, inconsistent security policies, difficulty in collaboration, and challenges in implementing single sign-on across directories.",0
9,"Your developers have created a portal web app for users in the Miami branch office. The web app will be publicly accessible and used by the Miami users to retrieve customer and product information. The web app is currently running in an on-premises test environment.
You plan to host the web app on Azure.
You need to determine which Azure web tier plan to host the web app. The web tier plan must meet the following requirements:
- The website will use the miami.weyland.com URL.
- The website will be deployed to two instances.
- SSL support must be included.
- The website requires 12 GB of storage.
- Costs must be minimized.
Which web tier plan should you use?
A. Standard
B. Basic
C. Free
D. Shared",A,"Free = 1 GB
Shared = 1 GB 
Basic = 10 GB 
Standard = 50 GB",0
10,"Your company is planning to migrate all their virtual machines to an Azure pay-as-you-go subscription. The virtual machines are currently hosted on the Hyper-V hosts in a data center.
You are required make sure that the intended Azure solution uses the correct expenditure model.
Solution: You should recommend the use of the elastic expenditure model.
Does the solution meet the goal?
A. Yes
B. No",B,"The solution does not meet the goal. There is no specific expenditure model called the ""elastic expenditure model"" in Azure. When migrating virtual machines to an Azure pay-as-you-go subscription, the appropriate expenditure model to consider is the ""pay-as-you-go"" or ""consumption-based"" model. This means that you will be billed based on the actual usage of Azure resources, such as virtual machines, storage, and networking, on an hourly or per-minute basis. Therefore, the correct solution would be to recommend the use of the ""pay-as-you-go"" expenditure model, not the ""elastic expenditure model.""",0
11,"Your company is planning to migrate all their virtual machines to an Azure pay-as-you-go subscription. The virtual machines are currently hosted on the Hyper-V hosts in a data center.
You are required make sure that the intended Azure solution uses the correct expenditure model.
Solution: You should recommend the use of the scalable expenditure model.
Does the solution meet the goal?
A. Yes
B. No",B,"There is no such thing as a ""scalable expenditure model"" in Azure. The two expenditure models in Azure are pay-as-you-go and reserved instances. Pay-as-you-go is the default and most common expenditure model in Azure. It means you pay for resources you consume on an hourly or per-minute basis. It offers flexibility to scale resources up and down as needed. Reserved instances is an expenditure model where you commit to a one- or three-year term for a particular virtual machine instance type, size, and region. This commitment provides you with a discount compared to pay-as-you-go pricing. Since the question states that the company is planning to migrate all of their virtual machines to an Azure pay-as-you-go subscription, the correct expenditure model is pay-as-you-go. ",0
12,"Your company is planning to migrate all their virtual machines to an Azure pay-as-you-go subscription. The virtual machines are currently hosted on the Hyper-V hosts in a data center.
You are required make sure that the intended Azure solution uses the correct expenditure model.
Solution: You should recommend the use of the operational expenditure model.
Does the solution meet the goal?
A. Yes
B. No",A,Operating expenditures are ongoing costs of doing business. Consuming cloud services in a pay-as-you-go model could qualify as an operating expenditure. ,0
13,"You are required to deploy an Artificial Intelligence (AI) solution in Azure.
You want to make sure that you are able to build, test, and deploy predictive analytics for the solution.
Solution: You should make use of Azure Cosmos DB.
Does the solution meet the goal?
A. Yes
B. No",B,"Azure Cosmos DB is a globally distributed, multi-model database service optimized for managing schema-less data at a global scale, offering high availability and low latency. For deploying an AI solution that involves building, testing, and deploying predictive analytics, services like Azure Machine Learning or Azure Cognitive Services are more appropriate, as they are specifically designed for AI workloads, including predictive analytics.",0
14,"Your company's Active Directory forest includes thousands of user accounts.
You have been informed that all network resources will be migrated to Azure. Thereafter, the on-premises data center will be retired.
You are required to employ a strategy that reduces the effect on users, once the planned migration has been completed.
Solution: You plan to sync all the Active Directory user accounts to Azure Active Directory (Azure AD).
Does the solution meet the goal?
A. Yes
B. No",A,"Syncing all the Active Directory user accounts to Azure Active Directory (Azure AD) is a common strategy to ensure a smooth migration to the cloud while minimizing the impact on users. This approach is often referred to as implementing a hybrid identity model. By syncing the user accounts to Azure AD using tools like Azure AD Connect, users can continue using their existing credentials to access cloud resources after the migration. This provides a seamless experience for users and reduces the disruption typically associated with migrations. Therefore, the solution of syncing Active Directory user accounts to Azure AD meets the goal of reducing the impact on users during the migration to Azure.",0
15,"You are required to deploy an Artificial Intelligence (AI) solution in Azure.
You want to make sure that you are able to build, test, and deploy predictive analytics for the solution.
Solution: You should make use of Azure Machine Learning Studio.
Does the solution meet the goal?
A. Yes
B. No",A,"Machine Learning Studio (classic) is a drag-and-drop tool you can use to build, test, and deploy predictive analytics solutions. ",0
16,"Your company's infrastructure includes a number of business units that each need a large number of various Azure resources for everyday operation.
The resources required by each business unit are identical.
You are required to sanction a strategy to create Azure resources automatically.
Solution: You recommend that the Azure API Management service be included in the strategy.
Does the solution meet the goal?
A. Yes
B. No",B,"Azure API Management is a service that helps create consistent and modern API gateways for existing back-end services. It does not provide a direct means to automate the creation of Azure resources. For automating resource creation, services like Azure Resource Manager templates, Azure Automation, or Azure DevOps would be more appropriate as they are designed to handle deployment and automation of resources on Azure.",0
17,"Your company's infrastructure includes a number of business units that each need a large number of various Azure resources for everyday operation.
The resources required by each business unit are identical.
You are required to sanction a strategy to create Azure resources automatically.
Solution: You recommend that management groups be included in the strategy.
Does the solution meet the goal?
A. Yes
B. No",B,"Management groups are used to organize resources and manage access, policy, and compliance across multiple subscriptions, but they are not specifically designed for automatically creating Azure resources. Instead, consider using Azure Resource Manager templates (ARM templates) or Azure Blueprints for automating the creation and management of Azure resources.",0
18,"Your company's infrastructure includes a number of business units that each need a large number of various Azure resources for everyday operation.
The resources required by each business unit are identical.
You are required to sanction a strategy to create Azure resources automatically.
Solution: You recommend that the Azure Resource Manager templates be included in the strategy.
Does the solution meet the goal?
A. Yes
B. No",A,"Using Azure Resource Manager (ARM) templates is a highly effective strategy for automatically creating and managing Azure resources, especially when you have identical requirements for multiple business units. ARM templates allow you to define your infrastructure as code, specifying the resources, configurations, and relationships in a declarative manner. By creating ARM templates that represent the required resources, you can deploy them consistently across different business units while ensuring that the configurations are identical. This approach is efficient, repeatable, and scalable, making it a suitable solution for automating resource deployment.",0
19,"You are tasked with deploying a critical LOB application, which will be installed on a virtual machine, to Azure.
You are informed that the application deployment strategy should allow for a guaranteed availability of 99.99 percent. You need to make sure that the strategy requires as little virtual machines and availability zones as possible.
Solution: You include two virtual machines and one availability zone in your strategy.
Does the solution meet the goal?
A. Yes
B. No",B,"Azure's SLA for Virtual Machines with a single instance is 99.5% availability. To achieve a guaranteed availability of 99.99%, you would need to deploy the application in an architecture that takes advantage of Azure's higher availability options, such as Availability Zones. For an SLA of 99.99%, deploying the application in at least two Availability Zones would be recommended. This would ensure that your application is highly available across separate physical locations, each with its own power, cooling, and networking, reducing the risk of a single point of failure. Simply deploying two virtual machines in a single Availability Zone would not achieve the desired level of availability.",0
20,"You are tasked with deploying a critical LOB application, which will be installed on a virtual machine, to Azure.
You are informed that the application deployment strategy should allow for a guaranteed availability of 99.99 percent. You need to make sure that the strategy requires as little virtual machines and availability zones as possible.
Solution: You include one virtual machine and two availability zones in your strategy.
Does the solution meet the goal?
A. Yes
B. No",B,"Deploying one virtual machine and two availability zones does not meet the goal of achieving a guaranteed availability of 99.99 percent. To achieve such a high level of availability, you typically need to distribute your application across multiple instances in multiple availability zones or sets.",0
21,"You are tasked with deploying a critical LOB application, which will be installed on a virtual machine, to Azure.
You are informed that the application deployment strategy should allow for a guaranteed availability of 99.99 percent. You need to make sure that the strategy requires as little virtual machines and availability zones as possible.
Solution: You include two virtual machines and two availability zones in your strategy.
Does the solution meet the goal?
A. Yes
B. No",A,"Deploying one virtual machine and two availability zones does not meet the goal of achieving a guaranteed availability of 99.99 percent. To achieve such a high level of availability, you typically need to distribute your application across multiple instances in multiple availability zones or sets.",0
22,"Your company's developers intend to deploy a large number of custom virtual machines on a weekly basis. They will also be removing these virtual machines during the same week it was deployed. Sixty percent of the virtual machines have Windows Server 2016 installed, while the other forty percent has Ubuntu Linux installed.
You are required to make sure that the administrative effort, needed for this process, is reduced by employing a suitable Azure service.
Solution: You recommend the use of Microsoft Managed Desktop.
Does the solution meet the goal?
A. Yes
B. No",B,"Microsoft Managed Desktop is not an appropriate solution for deploying and managing a large number of custom virtual machines on a weekly basis. Microsoft Managed Desktop is a service that provides managed Windows 10 devices for organizations, and it's not designed for managing virtual machines, especially with the frequency and diversity described in your scenario. For managing virtual machines in Azure, a more suitable solution would be to use Azure Automation or Azure Resource Manager (ARM) templates. These tools allow you to automate the deployment and management of virtual machines, including the creation, configuration, and deletion of resources. You can define your desired state in code, and these tools will handle the provisioning and management tasks, reducing administrative effort.",0
23,"Your company's developers intend to deploy a large number of custom virtual machines on a weekly basis. They will also be removing these virtual machines during the same week it was deployed. Sixty percent of the virtual machines have Windows Server 2016 installed, while the other forty percent has Ubuntu Linux installed.
You are required to make sure that the administrative effort, needed for this process, is reduced by employing a suitable Azure service.
Solution: You recommend the use of Azure Reserved Virtual Machines (VM) Instances.
Does the solution meet the goal?
A. Yes
B. No",B,"Azure Reserved Virtual Machine (VM) Instances are not the most suitable solution for deploying and managing a large number of custom virtual machines on a weekly basis that are also removed during the same week. Reserved VM Instances are used to save costs by committing to a specific VM instance type for a one- or three-year term, which is not aligned with the short-term and frequent deployment and removal pattern described in your scenario. To reduce administrative effort for your specific use case, you might consider using Azure DevTest Labs. Azure DevTest Labs allows you to quickly create environments in Azure while managing costs by setting up policies for resource usage. You can create a lab that aligns with your requirements, including Windows Server and Ubuntu Linux VMs, and allow your developers to deploy and remove VMs easily in a controlled environment.",0
24,"Your company's developers intend to deploy a large number of custom virtual machines on a weekly basis. They will also be removing these virtual machines during the same week it was deployed. Sixty percent of the virtual machines have Windows Server 2016 installed, while the other forty percent has Ubuntu Linux installed.
You are required to make sure that the administrative effort, needed for this process, is reduced by employing a suitable Azure service.
Solution: You recommend the use of Azure DevTest Labs.
Does the solution meet the goal?
A. Yes
B. No",A,"Azure DevTest Labs is a suitable Azure service for managing the deployment and lifecycle of custom virtual machines, especially when they need to be created and removed frequently, as in your scenario. With Azure DevTest Labs, you can create a lab environment where developers can quickly create and manage virtual machines for development and testing purposes. The lab management capabilities allow you to set up policies, quotas, and schedules, which can help reduce administrative effort and manage costs. By using Azure DevTest Labs, developers can easily deploy custom virtual machines with Windows Server 2016 and Ubuntu Linux as needed, and these VMs can be automatically cleaned up or removed at the end of the week. This approach streamlines the deployment and management process, ensuring that administrative effort is reduced while meeting the dynamic requirements of your developers. ",0
25,"Your company has virtual machines (VMs) hosted in Microsoft Azure. The VMs are located in a single Azure virtual network named VNet1.
The company has users that work remotely. The remote workers require access to the VMs on VNet1.
You need to provide access for the remote workers.
What should you do?
A. Configure a Site-to-Site (S2S) VPN.
B. Configure a VNet-toVNet VPN.
C. Configure a Point-to-Site (P2S) VPN.
D. Configure DirectAccess on a Windows Server 2012 server VM.
E. Configure a Multi-Site VPN",C,"To provide remote workers with access to the virtual machines (VMs) in the Azure virtual network (VNet), you should configure a Point-to-Site (P2S) VPN. P2S VPN allows individual remote clients to securely connect to the Azure VNet over the internet using a VPN client installed on their computer. This enables the remote workers to access the resources within VNet as if they were connected directly to the virtual network.",0
26,"You have been informed by your superiors of the company's intentions to automate server deployment to Azure. There is, however, some concern that administrative credentials could be uncovered during this process.
You are required to make sure that during the deployment, the administrative credentials are encrypted using a suitable Azure solution.
Solution: You recommend the use of Azure Information Protection.
Does the solution meet the goal?
A. Yes
B. No",B,"Azure Information Protection is primarily used for classifying, labeling, and protecting documents and emails containing sensitive information. It's not designed for encrypting administrative credentials during server deployment processes. For encrypting administrative credentials during server deployment to Azure, a more suitable solution would be to use Azure Key Vault. Azure Key Vault is a cloud service that allows you to safeguard cryptographic keys, certificates, and secrets used by cloud applications and services. You can store the administrative credentials securely in Azure Key Vault and retrieve them when needed during the deployment process. This ensures that the credentials are properly protected and managed.",0
